Anastasia,G,General Audiences. Suitable for all ages.,35,1997,93,80
Animaniacs,TV-Y7,Suitable for children ages 7 and older,41,1997,72,80
Flubber,PG,slapstick action and mild language,60,1997,83,80
Missione Hamburger,PG,"language-some comic violence and mild sex-related humor",60,1997,75,80
Mr. Magoo,PG,mild language and action sequences,60,1997,,82
Ninja Turtles: The Next Mutation,TV-Y7-FV,Suitable for children ages 7 and older.  Content contains fantasy violence.,42,1997,,82
Pooh's Grand Adventure: The Search for Christopher Robin,G,General Audiences. Suitable for all ages.,35,1997,,82
The Brave Little Toaster to the Rescue,G,General Audiences. Suitable for all ages.,35,1997,,82
The Magic School Bus,TV-Y,Suitable for all ages.,10,1997,81,80
